{
    "system": "Be creative and keep your response as short as possible.",
    "query": "Tell me a fantasy story about a captain. The story should have either a happy or a sad ending.",
    "response": "Captain Lyra stood at the helm of her ship, the \"Maelstrom's Fury\", gazing out at the endless sea. For years, she had sailed the seven seas, seeking the legendary Golden Isle, said to grant a single wish to whoever found it. After a lifetime of searching, Lyra finally spotted the island on the horizon.\n\nAs she stepped foot on its sandy shores, a warm glow enveloped her. Before her, a chest overflowing with glittering gold and jewels lay at her feet. Lyra's heart soared as she reached for the treasure. But, as she touched the gold, the isle began to fade away, leaving her with nothing but a whispered promise: \"The true treasure was the journey, not the gold.\" Lyra's eyes welled up with tears as she realized the bitter truth \u2013 she had sacrificed everything for fleeting riches, and lost the love of her crew, her family, and herself. The \"Maelstrom's Fury\" sailed away, a lonely shadow on the vast ocean, carrying a captain forever lost at sea.",
    "seed": 2,
    "temperature": 0.9,
    "top_p": 0.9,
    "top_k": 5,
    "sampler_type": "vocabulary",
    "start_from": 0,
    "token_list": {
        "0": "Captain",
        "1": " Ly",
        "2": "ra",
        "3": " stood",
        "4": " at",
        "5": " the",
        "6": " helm",
        "7": " of",
        "8": " her",
        "9": " ship",
        "10": ",",
        "11": " the",
        "12": " \"",
        "13": "M",
        "14": "ael",
        "15": "strom",
        "16": "'s",
        "17": " Fury",
        "18": "\",",
        "19": " g",
        "20": "azing",
        "21": " out",
        "22": " at",
        "23": " the",
        "24": " endless",
        "25": " sea",
        "26": ".",
        "27": " For",
        "28": " years",
        "29": ",",
        "30": " she",
        "31": " had",
        "32": " sailed",
        "33": " the",
        "34": " seven",
        "35": " seas",
        "36": ",",
        "37": " seeking",
        "38": " the",
        "39": " legendary",
        "40": " Golden",
        "41": " Isle",
        "42": ",",
        "43": " said",
        "44": " to",
        "45": " grant",
        "46": " a",
        "47": " single",
        "48": " wish",
        "49": " to",
        "50": " whoever",
        "51": " found",
        "52": " it",
        "53": ".",
        "54": " After",
        "55": " a",
        "56": " lifetime",
        "57": " of",
        "58": " searching",
        "59": ",",
        "60": " Ly",
        "61": "ra",
        "62": " finally",
        "63": " spotted",
        "64": " the",
        "65": " island",
        "66": " on",
        "67": " the",
        "68": " horizon",
        "69": ".\n\n",
        "70": "As",
        "71": " she",
        "72": " stepped",
        "73": " foot",
        "74": " on",
        "75": " its",
        "76": " sandy",
        "77": " shores",
        "78": ",",
        "79": " a",
        "80": " warm",
        "81": " glow",
        "82": " envelop",
        "83": "ed",
        "84": " her",
        "85": ".",
        "86": " Before",
        "87": " her",
        "88": ",",
        "89": " a",
        "90": " chest",
        "91": " overflowing",
        "92": " with",
        "93": " glitter",
        "94": "ing",
        "95": " gold",
        "96": " and",
        "97": " jewels",
        "98": " lay",
        "99": " at",
        "100": " her",
        "101": " feet",
        "102": ".",
        "103": " Ly",
        "104": "ra",
        "105": "'s",
        "106": " heart",
        "107": " soared",
        "108": " as",
        "109": " she",
        "110": " reached",
        "111": " for",
        "112": " the",
        "113": " treasure",
        "114": ".",
        "115": " But",
        "116": ",",
        "117": " as",
        "118": " she",
        "119": " touched",
        "120": " the",
        "121": " gold",
        "122": ",",
        "123": " the",
        "124": " is",
        "125": "le",
        "126": " began",
        "127": " to",
        "128": " fade",
        "129": " away",
        "130": ",",
        "131": " leaving",
        "132": " her",
        "133": " with",
        "134": " nothing",
        "135": " but",
        "136": " a",
        "137": " whispered",
        "138": " promise",
        "139": ":",
        "140": " \"",
        "141": "The",
        "142": " true",
        "143": " treasure",
        "144": " was",
        "145": " the",
        "146": " journey",
        "147": ",",
        "148": " not",
        "149": " the",
        "150": " gold",
        "151": ".\"",
        "152": " Ly",
        "153": "ra",
        "154": "'s",
        "155": " eyes",
        "156": " wel",
        "157": "led",
        "158": " up",
        "159": " with",
        "160": " tears",
        "161": " as",
        "162": " she",
        "163": " realized",
        "164": " the",
        "165": " bitter",
        "166": " truth",
        "167": " \u2013",
        "168": " she",
        "169": " had",
        "170": " sacrificed",
        "171": " everything",
        "172": " for",
        "173": " fleeting",
        "174": " riches",
        "175": ",",
        "176": " and",
        "177": " lost",
        "178": " the",
        "179": " love",
        "180": " of",
        "181": " her",
        "182": " crew",
        "183": ",",
        "184": " her",
        "185": " family",
        "186": ",",
        "187": " and",
        "188": " herself",
        "189": ".",
        "190": " The",
        "191": " \"",
        "192": "M",
        "193": "ael",
        "194": "strom",
        "195": "'s",
        "196": " Fury",
        "197": "\"",
        "198": " sailed",
        "199": " away",
        "200": ",",
        "201": " a",
        "202": " lonely",
        "203": " shadow",
        "204": " on",
        "205": " the",
        "206": " vast",
        "207": " ocean",
        "208": ",",
        "209": " carrying",
        "210": " a",
        "211": " captain",
        "212": " forever",
        "213": " lost",
        "214": " at",
        "215": " sea",
        "216": "."
    }
}