{
    "system": "Be creative and keep your response as short as possible.",
    "query": "Tell me a fantasy story about a captain. The story should have either a happy or a sad ending.",
    "response": "Captain Lyra stood at the helm of her trusty ship, the \"Maelstrom's Fury\", gazing out at the endless blue. For years, she'd sailed the seven seas, seeking the legendary Golden Isle, said to grant a single wish to whoever found it. After a lifetime of searching, Lyra finally spotted the island on the horizon.\n\nAs she anchored the ship and stepped onto the sandy beach, a warm light enveloped her. With trembling hands, she reached out and touched the glittering treasure. The Golden Isle's magic surged through her, and Lyra's greatest desire took hold: to reunite with her lost love, who'd perished at sea many years ago.\n\nWith tears of joy streaming down her face, Lyra opened her eyes to find her beloved standing before her, alive and well. The two shared a long, tender kiss, surrounded by the sweet scent of tropical flowers. The \"Maelstrom's Fury\" sailed away, its crew rejoicing, as Lyra and her love disappeared into the sunset, their hearts full of happiness.",
    "seed": 2,
    "temperature": 0.9,
    "top_p": 0.9,
    "top_k": 5,
    "sampler_type": "vocabulary",
    "start_from": 0,
    "token_list": {
        "0": "Captain",
        "1": " Ly",
        "2": "ra",
        "3": " stood",
        "4": " at",
        "5": " the",
        "6": " helm",
        "7": " of",
        "8": " her",
        "9": " trust",
        "10": "y",
        "11": " ship",
        "12": ",",
        "13": " the",
        "14": " \"",
        "15": "M",
        "16": "ael",
        "17": "strom",
        "18": "'s",
        "19": " Fury",
        "20": "\",",
        "21": " g",
        "22": "azing",
        "23": " out",
        "24": " at",
        "25": " the",
        "26": " endless",
        "27": " blue",
        "28": ".",
        "29": " For",
        "30": " years",
        "31": ",",
        "32": " she",
        "33": "'d",
        "34": " sailed",
        "35": " the",
        "36": " seven",
        "37": " seas",
        "38": ",",
        "39": " seeking",
        "40": " the",
        "41": " legendary",
        "42": " Golden",
        "43": " Isle",
        "44": ",",
        "45": " said",
        "46": " to",
        "47": " grant",
        "48": " a",
        "49": " single",
        "50": " wish",
        "51": " to",
        "52": " whoever",
        "53": " found",
        "54": " it",
        "55": ".",
        "56": " After",
        "57": " a",
        "58": " lifetime",
        "59": " of",
        "60": " searching",
        "61": ",",
        "62": " Ly",
        "63": "ra",
        "64": " finally",
        "65": " spotted",
        "66": " the",
        "67": " island",
        "68": " on",
        "69": " the",
        "70": " horizon",
        "71": ".\n\n",
        "72": "As",
        "73": " she",
        "74": " anchored",
        "75": " the",
        "76": " ship",
        "77": " and",
        "78": " stepped",
        "79": " onto",
        "80": " the",
        "81": " sandy",
        "82": " beach",
        "83": ",",
        "84": " a",
        "85": " warm",
        "86": " light",
        "87": " envelop",
        "88": "ed",
        "89": " her",
        "90": ".",
        "91": " With",
        "92": " trembling",
        "93": " hands",
        "94": ",",
        "95": " she",
        "96": " reached",
        "97": " out",
        "98": " and",
        "99": " touched",
        "100": " the",
        "101": " glitter",
        "102": "ing",
        "103": " treasure",
        "104": ".",
        "105": " The",
        "106": " Golden",
        "107": " Isle",
        "108": "'s",
        "109": " magic",
        "110": " surged",
        "111": " through",
        "112": " her",
        "113": ",",
        "114": " and",
        "115": " Ly",
        "116": "ra",
        "117": "'s",
        "118": " greatest",
        "119": " desire",
        "120": " took",
        "121": " hold",
        "122": ":",
        "123": " to",
        "124": " reun",
        "125": "ite",
        "126": " with",
        "127": " her",
        "128": " lost",
        "129": " love",
        "130": ",",
        "131": " who",
        "132": "'d",
        "133": " per",
        "134": "ished",
        "135": " at",
        "136": " sea",
        "137": " many",
        "138": " years",
        "139": " ago",
        "140": ".\n\n",
        "141": "With",
        "142": " tears",
        "143": " of",
        "144": " joy",
        "145": " streaming",
        "146": " down",
        "147": " her",
        "148": " face",
        "149": ",",
        "150": " Ly",
        "151": "ra",
        "152": " opened",
        "153": " her",
        "154": " eyes",
        "155": " to",
        "156": " find",
        "157": " her",
        "158": " beloved",
        "159": " standing",
        "160": " before",
        "161": " her",
        "162": ",",
        "163": " alive",
        "164": " and",
        "165": " well",
        "166": ".",
        "167": " The",
        "168": " two",
        "169": " shared",
        "170": " a",
        "171": " long",
        "172": ",",
        "173": " tender",
        "174": " kiss",
        "175": ",",
        "176": " surrounded",
        "177": " by",
        "178": " the",
        "179": " sweet",
        "180": " scent",
        "181": " of",
        "182": " tropical",
        "183": " flowers",
        "184": ".",
        "185": " The",
        "186": " \"",
        "187": "M",
        "188": "ael",
        "189": "strom",
        "190": "'s",
        "191": " Fury",
        "192": "\"",
        "193": " sailed",
        "194": " away",
        "195": ",",
        "196": " its",
        "197": " crew",
        "198": " rejo",
        "199": "icing",
        "200": ",",
        "201": " as",
        "202": " Ly",
        "203": "ra",
        "204": " and",
        "205": " her",
        "206": " love",
        "207": " disappeared",
        "208": " into",
        "209": " the",
        "210": " sunset",
        "211": ",",
        "212": " their",
        "213": " hearts",
        "214": " full",
        "215": " of",
        "216": " happiness",
        "217": "."
    }
}